{
    "name": "Default Bridge Config",
    "mode": "dev",
    "bridge": {
        "name": "BRIDGE",
        "module_name": "bridge",
        "flows": [
            {
                "name": "warehouse-analysis",
                "source": {
                    "module_name": "warehouse",
                    "name": "warehouse-producer",
                    "key": "k3y-h3r3-w4r3h0us3-4n4ly515"
                },
                "target": {
                    "module_name": "analysis",
                    "name": "analysis-consumer",
                    "key": "k3y-h3r3-w4r3h0us3-4n4ly515"
                }
            }
        ],
        "websocket_ip": "0.0.0.0",
        "websocket_port": 4000
    },
    "api": {
        "name": "BridgeAPI",
        "rest_ip": "0.0.0.0",
        "rest_port": 4100
    }
}